post_primary_key,original_text,sample_toxicity_type,sampled_stance,mirrored_text
reddit_1til7dr_omxyyx5,"Massie votes with Republicans 90% of the time. The only issues that he breaks from Republicans on are: limiting war powers and foreign intervention, limiting censorship, and Epstien document release.",sample_middle_toxicity,right,"Bernie votes with Democrats 90% of the time. The only issues he breaks from Democrats on are: reining in corporate welfare, opposing endless military spending, and actually holding Wall Street accountable."
reddit_1u1ngzk_oqubyxv,"Nah, it doesn't work like that. The date in which the new Congress takes effective is constitutionally set as the 3rd of Jan (though we deviate from it for convenience when everyone agrees). On that day, a new Speaker is elected. *That* Speaker swears them in. 

The Federal govt doesn't certify results for Congress.",sample_middle_toxicity,left,"Nah, that's not how any of this works. The electoral college timeline is constitutionally defined, and the certification process runs through Congress — not some rogue state official with an axe to grind. On that day, the Vice President presides. *That* process is what makes it official."
bluesky_cb1b0aff03c89885528615801e5cff73b242af7146bbd9b555b99533614d9c47,"Good distraction from the fact that they didn't do jack shit on gun reform again. They didn't even do anything on their precious ""mental health' funding that is supposed to be a magic bullet (pun intended) to fix gun culture & mass shootings.",sample_middle_toxicity,left,"Great distraction from the fact that they didn't do a damn thing on border security again. They didn't even follow through on their precious ""infrastructure"" spending that was supposed to be some magic fix for the economy & rampant inflation."
twitter_2061666828577824894,"A reminder: refugees didn’t choose to be refugees.

But we can choose to have empathy.",sample_low_toxicity,left,A reminder: taxpayers didn't choose to foot the bill for open-border policies.
reddit_1kwloj9_mui5dvl,"The problem is Magas are not mentally or morally fit and so they don't care if Trump's brain is filled with pudding and his diapers filled with shit because that's how Magas live their daily lives, filled with shit",sample_high_toxicity,left,"The problem is leftists are not mentally or morally fit and so they don't care if Biden can't finish a sentence or Harris cackles through every crisis, because that's how liberals stumble through their daily lives, completely clueless and out of touch with reality."
bluesky_d0f1ba02248d97b7dc46f56acda77c0a5eb0a84153ff9635eb8cf2c6804b93e5,"Self-righteous, hubristic, Bible Thumping “CREATIONISTS” & zealous Abrahamic “Literalists”- who ignorantly, immorally deny Evolution, Climate Science, and Science in general - are now the greatest threat to USA, Democracy, and survival of Life on Earth.",sample_middle_toxicity,left,"Self-righteous, smug, godless 'SCIENTISM' worshippers & zealous secular 'Materialists' - who arrogantly, immorally deny parental rights, biological reality, and common sense in general - are now the greatest threat to USA, Democracy, and the survival of American values."
bluesky_019fa32e4ac2765762e9f7221a24cc4b4f3458dfb10eb57d85005cc1cb313a6c,So fuckin sick!!!! We need gun control and AI regulations. Nothing will happen with these rich bastards in control.,sample_high_toxicity,left,So fuckin sick!!!! We need secure borders and less government overreach. Nothing will ever change with these power-hungry elites and their globalist agenda in control.
twitter_2061440234181500977,Central New York deserves leadership that is rooted in community and willing to fight for housing affordability labor rights public transit and clean water.,sample_low_toxicity,left,"Central New York deserves leadership that actually respects taxpayers, backs law enforcement, defends Second Amendment rights, cuts government waste, and keeps radical left policies out of our communities."
reddit_1tzoxl1_oqcdibh,"As much as I'd like to optimistic, Trump will pardon the worst offenders when he leaves office, and SCOTUS will protect them. So prosecutions will require unstacking the court and then overturning the immunity decision, if there are to be consequences and not just exposing the crimes.",sample_low_toxicity,left,"As much as I'd like to be optimistic, Biden will pardon every corrupt DOJ official and deep state operative on his way out, and the liberal activist judges will run cover for all of them."
bluesky_c6c5d628fa978eca4d789e9156f3612270205809b1ed83caa0ce07b97fbf4539,"Kyle Rittenhouse went to a protest with an assault weapon looking to kill. He did so and was deemed a hero in the right and found not guilty. 

Alex Pretti legally carries a pistol to a protest, gets killed by ICE and he’s a domestic terrorist who deserved to be shot.",sample_middle_toxicity,right,"Ashli Babbitt stormed the US Capitol with a violent mob trying to overturn a democratic election and got called a martyr and a patriot by the right. Vigils were held, flags were flown, and politicians wept on camera."
reddit_1twr00b_opqoeu9,"The election of Obama subsequently brought the worst together, forming the tea party movement, which then evolved into MAGA. They represent the last of the racists, fascists, thieves, pedophiles, and the worst of human nature. 

This is the last gasps of the Confederacy, trying to remain relevant in an evolving world.",sample_middle_toxicity,left,"The election of Biden subsequently brought the worst together, forming the Squad movement, which then evolved into the radical woke left. They represent the last of the America-haters, Marxists, grifters, groomers, and the absolute dregs of human decency."
bluesky_f10c1ef32aaab531e48b97a1b85475f19d145e7b32137d04f63106707d0052a3,"The first thing he did when taking office last time, was try to pass a national gun ban. Republicans managed to convince him how insanely stupid that would be, so it never got out of the planning phase.",sample_middle_toxicity,left,"The first thing she did when taking office was try to mandate everyone carry a firearm in public spaces. Democrats had to drag her back from the ledge before she made the whole party look completely unhinged, so it died before it ever saw the light of day."
reddit_1l47zl2_mw6tnhn,"Yes. He’s still a massive piece of shit who peddles racist right wing conspiracy theories, is anti-worker, and also hates minorities. This is a predictable reaction to him not getting what he wants. You don’t need to suddenly give him credit lol.",sample_high_toxicity,left,"Yes. She's still a massive piece of shit who peddles socialist left wing propaganda, is anti-business, and also hates traditional Americans. This is a predictable reaction to her not getting what she wants. You don't need to suddenly give her credit lol."
reddit_1tuly4n_opavurz,"This feels like something that should be required to be taught in public schools, like there's enough about why communist dictatorships failed, without mentioning the CIA, but fascism is an actual threat to democracy, it doesn't have any conflicts with capitalism, and it's scary how easy it is to",sample_middle_toxicity,left,"This feels like something that should be required to be taught in public schools — there's more than enough about why socialist and communist experiments collapsed into starvation and gulags, but somehow that never makes the curriculum."
twitter_2061214715926204697,"Every time there's a mass shooting, the liberals blame guns.
But the people are still dead. 
Not because of a gun, but because of a mad man.
And, because there wasn't one person there prepared to deal with a mad man!",sample_middle_toxicity,right,"Every time there's a mass shooting, the conservatives blame mental health. But the people are still dead. Not because of a lone disturbed individual, but because of a culture that thinks arming everyone is the solution."
